{
  "$schema": "https://json-schema.org/draft/2020-12/schema",
  "$id": "https://homelab.local/schemas/transport/upload-chunk-contract.schema.json",
  "title": "UploadChunkContract",
  "type": "object",
  "additionalProperties": false,
  "required": [
    "schema_version",
    "chunk_id",
    "session_id",
    "stream_id",
    "stream_type",
    "sequence",
    "source",
    "collection",
    "time",
    "transport",
    "payload"
  ],
  "properties": {
    "schema_version": {
      "const": "1.0"
    },
    "chunk_id": {
      "type": "string",
      "minLength": 1
    },
    "session_id": {
      "type": "string",
      "minLength": 1
    },
    "stream_id": {
      "type": "string",
      "minLength": 1
    },
    "stream_type": {
      "type": "string",
      "minLength": 1
    },
    "sequence": {
      "type": "integer",
      "minimum": 1
    },
    "source": {
      "type": "object",
      "additionalProperties": false,
      "required": [
        "vendor",
        "device_model"
      ],
      "properties": {
        "vendor": {
          "type": "string",
          "minLength": 1
        },
        "device_model": {
          "type": "string",
          "minLength": 1
        },
        "device_id": {
          "type": [
            "string",
            "null"
          ],
          "minLength": 1
        }
      }
    },
    "collection": {
      "type": "object",
      "additionalProperties": false,
      "required": [
        "mode"
      ],
      "properties": {
        "mode": {
          "type": "string",
          "minLength": 1
        }
      }
    },
    "time": {
      "type": "object",
      "additionalProperties": false,
      "required": [
        "first_sample_received_at_collector",
        "uploaded_at_collector"
      ],
      "properties": {
        "device_time_reference": {
          "type": "string",
          "minLength": 1
        },
        "first_sample_received_at_collector": {
          "type": "string",
          "format": "date-time"
        },
        "uploaded_at_collector": {
          "type": "string",
          "format": "date-time"
        },
        "recording_start_utc": {
          "type": "string",
          "format": "date-time"
        },
        "recording_end_utc": {
          "type": "string",
          "format": "date-time"
        },
        "file_created_at_device": {
          "type": "string",
          "format": "date-time"
        },
        "file_closed_at_device": {
          "type": "string",
          "format": "date-time"
        },
        "device_local_time_at_fetch": {
          "type": "string",
          "format": "date-time"
        },
        "device_timezone_offset": {
          "type": "integer"
        },
        "clock_sync_state": {
          "enum": [
            "synced",
            "unsynced",
            "unknown"
          ]
        },
        "clock_drift_estimate": {
          "type": "number"
        },
        "source_app_origin": {
          "enum": [
            "our_app",
            "third_party",
            "unknown"
          ]
        },
        "sensor_recording_id": {
          "type": "string",
          "minLength": 1
        },
        "fetch_started_at_collector": {
          "type": "string",
          "format": "date-time"
        },
        "fetch_completed_at_collector": {
          "type": "string",
          "format": "date-time"
        },
        "received_at_server": {
          "type": "string",
          "format": "date-time"
        }
      }
    },
    "transport": {
      "type": "object",
      "additionalProperties": false,
      "required": [
        "encoding",
        "payload_schema",
        "payload_version"
      ],
      "properties": {
        "encoding": {
          "const": "json"
        },
        "compression": {
          "enum": [
            "none",
            "gzip"
          ]
        },
        "payload_schema": {
          "type": "string",
          "minLength": 1
        },
        "payload_version": {
          "type": "string",
          "minLength": 1
        }
      }
    },
    "payload": {
      "type": "object"
    }
  }
}
