{
  "schema_version": "1.0",
  "chunk_id": "75dc503e-94e2-45db-9a93-a68dd385224b",
  "session_id": "6c787e4d-6beb-4e40-afe5-a6411e81ce2a",
  "stream_id": "stream-offline-mag-6c787e4d-6beb-4e40-afe5-a6411e81ce2a",
  "stream_type": "mag",
  "sequence": 3,
  "source": {
    "vendor": "polar",
    "device_model": "verity_sense",
    "device_id": "B15B5829"
  },
  "collection": {
    "mode": "offline_recording"
  },
  "time": {
    "device_time_reference": "polar",
    "first_sample_received_at_collector": "2026-04-30T16:19:54.276Z",
    "uploaded_at_collector": "2026-04-30T16:20:11.842Z",
    "received_at_server": "2026-04-30T16:20:11.918693Z"
  },
  "transport": {
    "payload_schema": "polar.offline.mag",
    "payload_version": "1.0",
    "encoding": "json",
    "compression": "none"
  },
  "payload": {
    "type": "MAG",
    "source": "polar_verity_sense_offline",
    "samples": [
      {"timeStamp": 545998022744700480, "x": -0.8115, "y": -0.84000003, "z": 0.9075},
      {"timeStamp": 545998022844700480, "x": -0.81, "y": -0.825, "z": 0.909},
      {"timeStamp": 545998063914177598, "x": -1.0365, "y": -0.8385, "z": 0.726}
    ]
  }
}
